{"enums":[],"relationships":[],"scalars":[],"tables":[{"constraints":[],"directives":{"table":true},"fields":[{"directives":{"pk":true},"name":"id","nullable":false,"type":{"base":"ID","isList":false}},{"directives":{"unique":true},"name":"username","nullable":false,"type":{"base":"String","isList":false}},{"directives":{},"name":"email","nullable":false,"type":{"base":"String","isList":false}},{"directives":{"default":{"value":"now()"}},"name":"created_at","nullable":false,"type":{"base":"String","isList":false}}],"indexes":[],"name":"users"}],"version":"1.0.0"}