{"enums":[],"relationships":[{"from":{"field":"org_id","table":"members"},"to":{"field":"id","table":"organizations"},"type":"one-to-many"},{"from":{"field":"user_id","table":"members"},"to":{"field":"id","table":"users"},"type":"one-to-many"},{"from":{"field":"org_id","table":"projects"},"to":{"field":"id","table":"organizations"},"type":"one-to-many"}],"scalars":[],"tables":[{"constraints":[],"directives":{"table":true},"fields":[{"directives":{"pk":true},"name":"id","nullable":false,"type":{"base":"ID","isList":false}},{"directives":{"fk":{"targetField":"id","targetTable":"organizations"}},"name":"org_id","nullable":false,"type":{"base":"ID","isList":false}},{"directives":{"fk":{"targetField":"id","targetTable":"users"}},"name":"user_id","nullable":false,"type":{"base":"ID","isList":false}},{"directives":{"default":{"value":"member"}},"name":"role","nullable":false,"type":{"base":"String","isList":false}},{"directives":{"default":{"value":"now()"}},"name":"joined_at","nullable":false,"type":{"base":"String","isList":false}}],"indexes":[],"name":"members"},{"constraints":[],"directives":{"table":true},"fields":[{"directives":{"pk":true},"name":"id","nullable":false,"type":{"base":"ID","isList":false}},{"directives":{},"name":"name","nullable":false,"type":{"base":"String","isList":false}},{"directives":{"unique":true},"name":"slug","nullable":false,"type":{"base":"String","isList":false}}],"indexes":[],"name":"organizations"},{"constraints":[],"directives":{"table":true},"fields":[{"directives":{"pk":true},"name":"id","nullable":false,"type":{"base":"ID","isList":false}},{"directives":{"fk":{"targetField":"id","targetTable":"organizations"}},"name":"org_id","nullable":false,"type":{"base":"ID","isList":false}},{"directives":{},"name":"name","nullable":false,"type":{"base":"String","isList":false}},{"directives":{},"name":"description","nullable":true,"type":{"base":"String","isList":false}}],"indexes":[],"name":"projects"},{"constraints":[],"directives":{"table":true},"fields":[{"directives":{"pk":true},"name":"id","nullable":false,"type":{"base":"ID","isList":false}},{"directives":{"unique":true},"name":"username","nullable":false,"type":{"base":"String","isList":false}},{"directives":{},"name":"email","nullable":false,"type":{"base":"String","isList":false}},{"directives":{"default":{"value":"now()"}},"name":"created_at","nullable":false,"type":{"base":"String","isList":false}}],"indexes":[],"name":"users"}],"version":"1.0.0"}