{
  "version": "1.0.0",
  "metadata": {
    "generatedAt": "2026-05-06T00:44:47.934Z"
  },
  "tables": [
    {
      "name": "users",
      "directives": {
        "table": true
      },
      "fields": [
        {
          "name": "id",
          "type": {
            "base": "ID",
            "isList": false
          },
          "nullable": false,
          "directives": {
            "pk": true
          }
        },
        {
          "name": "username",
          "type": {
            "base": "String",
            "isList": false
          },
          "nullable": false,
          "directives": {
            "unique": true
          }
        },
        {
          "name": "email",
          "type": {
            "base": "String",
            "isList": false
          },
          "nullable": false,
          "directives": {}
        },
        {
          "name": "created_at",
          "type": {
            "base": "String",
            "isList": false
          },
          "nullable": false,
          "directives": {
            "default": {
              "value": "now()"
            }
          }
        }
      ],
      "indexes": [],
      "constraints": []
    }
  ],
  "enums": [],
  "scalars": [],
  "relationships": []
}